{
  "code": "AAPL",
  "name": "Apple Inc.",
  "market": "US",
  "as_of": "2026-08-10T14:59:52.583886+00:00",
  "source": "edgar",
  "growth": {
    "latest_year": "2025",
    "value": 6.43,
    "cagr_pct": 1.81,
    "judgment": "good",
    "series": [
      {
        "year": "2021",
        "value": 365817000000
      },
      {
        "year": "2022",
        "value": 394328000000
      },
      {
        "year": "2023",
        "value": 383285000000
      },
      {
        "year": "2024",
        "value": 391035000000
      },
      {
        "year": "2025",
        "value": 416161000000
      }
    ]
  },
  "profitability": {
    "latest_year": "2025",
    "value": 31.97,
    "own_5y_avg": 28.39,
    "judgment": "good",
    "series": [
      {
        "year": "2021",
        "value": 29.78
      },
      {
        "year": "2022",
        "value": 30.29
      },
      {
        "year": "2023",
        "value": 29.82
      },
      {
        "year": "2024",
        "value": 31.51
      },
      {
        "year": "2025",
        "value": 31.97
      }
    ]
  },
  "stability": {
    "latest_year": "2025",
    "value": 387.22,
    "judgment": "caution",
    "series": [
      {
        "year": "2021",
        "value": 456.35
      },
      {
        "year": "2022",
        "value": 596.15
      },
      {
        "year": "2023",
        "value": 467.35
      },
      {
        "year": "2024",
        "value": 540.88
      },
      {
        "year": "2025",
        "value": 387.22
      }
    ]
  },
  "cashflow": {
    "latest_year": "2025",
    "value": 98767000000,
    "judgment": "good",
    "series": [
      {
        "year": "2016",
        "value": 53497000000
      },
      {
        "year": "2017",
        "value": 51774000000
      },
      {
        "year": "2018",
        "value": 64121000000
      },
      {
        "year": "2019",
        "value": 58896000000
      },
      {
        "year": "2020",
        "value": 73365000000
      },
      {
        "year": "2021",
        "value": 92953000000
      },
      {
        "year": "2022",
        "value": 111443000000
      },
      {
        "year": "2023",
        "value": 99584000000
      },
      {
        "year": "2024",
        "value": 108807000000
      },
      {
        "year": "2025",
        "value": 98767000000
      }
    ]
  },
  "valuation": {
    "latest_year": "2025",
    "eps": 7.46,
    "per": 42.0,
    "note": null
  },
  "triangle": {
    "latest_year": "2025",
    "price": 313.3299865722656,
    "eps": 7.46,
    "bps": 4.91,
    "roe": 151.91,
    "per": 42.0,
    "pbr": 63.81,
    "roe_series": [
      {
        "year": "2021",
        "value": 150.07
      },
      {
        "year": "2022",
        "value": 196.96
      },
      {
        "year": "2023",
        "value": 156.08
      },
      {
        "year": "2024",
        "value": 164.59
      },
      {
        "year": "2025",
        "value": 151.91
      }
    ],
    "note": null
  }
}