{
  "code": "001210",
  "name": "금호전기",
  "market": "KOSPI",
  "as_of": "2026-08-15T04:21:06.181258+00:00",
  "source": "dart",
  "growth": {
    "latest_year": "2025",
    "value": -16.61,
    "cagr_pct": -1.23,
    "judgment": "caution",
    "series": [
      {
        "year": "2022",
        "value": 46015093156.0
      },
      {
        "year": "2023",
        "value": 53372993650.0
      },
      {
        "year": "2024",
        "value": 53171559352.0
      },
      {
        "year": "2025",
        "value": 44337718233.0
      }
    ]
  },
  "profitability": {
    "latest_year": "2025",
    "value": -2.67,
    "own_5y_avg": -13.26,
    "judgment": "good",
    "series": [
      {
        "year": "2022",
        "value": -25.62
      },
      {
        "year": "2023",
        "value": -15.42
      },
      {
        "year": "2024",
        "value": -9.32
      },
      {
        "year": "2025",
        "value": -2.67
      }
    ]
  },
  "stability": {
    "latest_year": "2025",
    "value": 204.26,
    "judgment": "caution",
    "series": [
      {
        "year": "2022",
        "value": 381.44
      },
      {
        "year": "2023",
        "value": 640.11
      },
      {
        "year": "2024",
        "value": 273.96
      },
      {
        "year": "2025",
        "value": 204.26
      }
    ]
  },
  "cashflow": {
    "latest_year": "2025",
    "value": 3755831370.0,
    "judgment": "neutral",
    "series": [
      {
        "year": "2022",
        "value": -9391850927.0
      },
      {
        "year": "2023",
        "value": -2632804934.0
      },
      {
        "year": "2024",
        "value": -1618304871.0
      },
      {
        "year": "2025",
        "value": 3755831370.0
      }
    ]
  },
  "valuation": null,
  "triangle": {
    "latest_year": "2025",
    "price": 6490.0,
    "eps": null,
    "bps": null,
    "roe": -38.91,
    "per": null,
    "pbr": null,
    "roe_series": [
      {
        "year": "2022",
        "value": -131.66
      },
      {
        "year": "2023",
        "value": -256.6
      },
      {
        "year": "2024",
        "value": -155.27
      },
      {
        "year": "2025",
        "value": -38.91
      }
    ],
    "note": "EPS 미수집 — PER·PBR·BPS 산출 불가"
  }
}